Initialized native services in: /home/users/lz280/.gradle/native
Initialized jansi services in: /home/users/lz280/.gradle/native
The client will now receive all logging from the daemon (pid: 47000). The daemon log file: /home/users/lz280/.gradle/daemon/7.3/daemon-47000.out.log
Starting 8th build in daemon [uptime: 8 mins 52.708 secs, performance: 100%, non-heap usage: 35% of 256 MiB]
Using 12 worker leases.
Closing daemon's stdin at end of input.
The daemon will no longer process any standard input.
Not watching /home/users/lz280/IdeaProjects/OSPREY3 since the file system is not supported
Not watching /home/users/lz280/IdeaProjects/OSPREY3/buildSrc since the file system is not supported
Watching the file system is configured to be enabled if available
File system watching is active
Starting Build
Settings evaluated using settings file '/home/users/lz280/IdeaProjects/OSPREY3/settings.gradle'.
Projects loaded. Root project using build file '/home/users/lz280/IdeaProjects/OSPREY3/build.gradle.kts'.
Included projects: [root project 'osprey']

> Configure project :buildSrc
Evaluating project ':buildSrc' using build file '/home/users/lz280/IdeaProjects/OSPREY3/buildSrc/build.gradle.kts'.
kotlin scripting plugin: created the scripting discovery configuration: kotlinScriptDef
kotlin scripting plugin: created the scripting discovery configuration: testKotlinScriptDef
file or directory '/home/users/lz280/IdeaProjects/OSPREY3/buildSrc/src/main/groovy', not found
Caching disabled for Kotlin DSL accessors for project ':buildSrc' because:
  Build cache is disabled
Skipping Kotlin DSL accessors for project ':buildSrc' as it is up-to-date.
Selected primary task 'build' from project :
:buildSrc:compileKotlin (Thread[Execution worker for ':buildSrc',5,main]) started.

> Task :buildSrc:compileKotlin UP-TO-DATE
Caching disabled for task ':buildSrc:compileKotlin' because:
  Build cache is disabled
Skipping task ':buildSrc:compileKotlin' as it is up-to-date.
:buildSrc:compileKotlin (Thread[Execution worker for ':buildSrc',5,main]) completed. Took 0.054 secs.
:buildSrc:compileJava (Thread[Execution worker for ':buildSrc',5,main]) started.

> Task :buildSrc:compileJava UP-TO-DATE
Caching disabled for task ':buildSrc:compileJava' because:
  Build cache is disabled
Skipping task ':buildSrc:compileJava' as it is up-to-date.
:buildSrc:compileJava (Thread[Execution worker for ':buildSrc',5,main]) completed. Took 0.008 secs.
:buildSrc:compileGroovy (Thread[Execution worker for ':buildSrc',5,main]) started.

> Task :buildSrc:compileGroovy NO-SOURCE
file or directory '/home/users/lz280/IdeaProjects/OSPREY3/buildSrc/src/main/groovy', not found
Skipping task ':buildSrc:compileGroovy' as it has no source files and no previous output files.
:buildSrc:compileGroovy (Thread[Execution worker for ':buildSrc',5,main]) completed. Took 0.0 secs.
:buildSrc:pluginDescriptors (Thread[Execution worker for ':buildSrc',5,main]) started.

> Task :buildSrc:pluginDescriptors UP-TO-DATE
Caching disabled for task ':buildSrc:pluginDescriptors' because:
  Build cache is disabled
Skipping task ':buildSrc:pluginDescriptors' as it is up-to-date.
:buildSrc:pluginDescriptors (Thread[Execution worker for ':buildSrc',5,main]) completed. Took 0.001 secs.
:buildSrc:processResources (Thread[Execution worker for ':buildSrc',5,main]) started.

> Task :buildSrc:processResources UP-TO-DATE
Caching disabled for task ':buildSrc:processResources' because:
  Build cache is disabled
Skipping task ':buildSrc:processResources' as it is up-to-date.
:buildSrc:processResources (Thread[Execution worker for ':buildSrc',5,main]) completed. Took 0.003 secs.
:buildSrc:classes (Thread[Execution worker for ':buildSrc',5,main]) started.

> Task :buildSrc:classes UP-TO-DATE
Skipping task ':buildSrc:classes' as it has no actions.
:buildSrc:classes (Thread[Execution worker for ':buildSrc',5,main]) completed. Took 0.0 secs.
:buildSrc:inspectClassesForKotlinIC (Thread[Execution worker for ':buildSrc',5,main]) started.

> Task :buildSrc:inspectClassesForKotlinIC UP-TO-DATE
Caching disabled for task ':buildSrc:inspectClassesForKotlinIC' because:
  Build cache is disabled
Skipping task ':buildSrc:inspectClassesForKotlinIC' as it is up-to-date.
:buildSrc:inspectClassesForKotlinIC (Thread[Execution worker for ':buildSrc',5,main]) completed. Took 0.001 secs.
:buildSrc:jar (Thread[Execution worker for ':buildSrc',5,main]) started.

> Task :buildSrc:jar UP-TO-DATE
Caching disabled for task ':buildSrc:jar' because:
  Build cache is disabled
Skipping task ':buildSrc:jar' as it is up-to-date.
:buildSrc:jar (Thread[Execution worker for ':buildSrc',5,main]) completed. Took 0.003 secs.
:buildSrc:assemble (Thread[Execution worker for ':buildSrc',5,main]) started.

> Task :buildSrc:assemble UP-TO-DATE
Skipping task ':buildSrc:assemble' as it has no actions.
:buildSrc:assemble (Thread[Execution worker for ':buildSrc',5,main]) completed. Took 0.0 secs.
:buildSrc:compileTestKotlin (Thread[Execution worker for ':buildSrc',5,main]) started.

> Task :buildSrc:compileTestKotlin UP-TO-DATE
file or directory '/home/users/lz280/IdeaProjects/OSPREY3/buildSrc/src/test/kotlin', not found
Caching disabled for task ':buildSrc:compileTestKotlin' because:
  Build cache is disabled
Skipping task ':buildSrc:compileTestKotlin' as it is up-to-date.
:buildSrc:compileTestKotlin (Thread[Execution worker for ':buildSrc',5,main]) completed. Took 0.022 secs.
:buildSrc:pluginUnderTestMetadata (Thread[Execution worker for ':buildSrc',5,main]) started.

> Task :buildSrc:pluginUnderTestMetadata UP-TO-DATE
Caching disabled for task ':buildSrc:pluginUnderTestMetadata' because:
  Build cache is disabled
Skipping task ':buildSrc:pluginUnderTestMetadata' as it is up-to-date.
:buildSrc:pluginUnderTestMetadata (Thread[Execution worker for ':buildSrc',5,main]) completed. Took 0.034 secs.
:buildSrc:compileTestJava (Thread[Execution worker for ':buildSrc',5,main]) started.

> Task :buildSrc:compileTestJava UP-TO-DATE
Caching disabled for task ':buildSrc:compileTestJava' because:
  Build cache is disabled
Skipping task ':buildSrc:compileTestJava' as it is up-to-date.
:buildSrc:compileTestJava (Thread[Execution worker for ':buildSrc',5,main]) completed. Took 0.005 secs.
:buildSrc:compileTestGroovy (Thread[Execution worker for ':buildSrc',5,main]) started.

> Task :buildSrc:compileTestGroovy NO-SOURCE
file or directory '/home/users/lz280/IdeaProjects/OSPREY3/buildSrc/src/test/groovy', not found
Skipping task ':buildSrc:compileTestGroovy' as it has no source files and no previous output files.
:buildSrc:compileTestGroovy (Thread[Execution worker for ':buildSrc',5,main]) completed. Took 0.0 secs.
:buildSrc:processTestResources (Thread[Execution worker for ':buildSrc',5,main]) started.

> Task :buildSrc:processTestResources NO-SOURCE
file or directory '/home/users/lz280/IdeaProjects/OSPREY3/buildSrc/src/test/resources', not found
Skipping task ':buildSrc:processTestResources' as it has no source files and no previous output files.
:buildSrc:processTestResources (Thread[Execution worker for ':buildSrc',5,main]) completed. Took 0.0 secs.
:buildSrc:testClasses (Thread[Execution worker for ':buildSrc',5,main]) started.

> Task :buildSrc:testClasses UP-TO-DATE
Skipping task ':buildSrc:testClasses' as it has no actions.
:buildSrc:testClasses (Thread[Execution worker for ':buildSrc',5,main]) completed. Took 0.0 secs.
:buildSrc:test (Thread[Execution worker for ':buildSrc',5,main]) started.

> Task :buildSrc:test UP-TO-DATE
Caching disabled for task ':buildSrc:test' because:
  Build cache is disabled
Skipping task ':buildSrc:test' as it is up-to-date.
:buildSrc:test (Thread[Execution worker for ':buildSrc',5,main]) completed. Took 0.011 secs.
:buildSrc:validatePlugins (Thread[Execution worker for ':buildSrc',5,main]) started.

> Task :buildSrc:validatePlugins UP-TO-DATE
Caching disabled for task ':buildSrc:validatePlugins' because:
  Build cache is disabled
Skipping task ':buildSrc:validatePlugins' as it is up-to-date.
:buildSrc:validatePlugins (Thread[Execution worker for ':buildSrc',5,main]) completed. Took 0.001 secs.
:buildSrc:check (Thread[Execution worker for ':buildSrc',5,main]) started.

> Task :buildSrc:check UP-TO-DATE
Skipping task ':buildSrc:check' as it has no actions.
:buildSrc:check (Thread[Execution worker for ':buildSrc',5,main]) completed. Took 0.0 secs.
:buildSrc:build (Thread[Execution worker for ':buildSrc' Thread 10,5,main]) started.

> Task :buildSrc:build UP-TO-DATE
Skipping task ':buildSrc:build' as it has no actions.
:buildSrc:build (Thread[Execution worker for ':buildSrc' Thread 10,5,main]) completed. Took 0.0 secs.

> Configure project :
Evaluating root project 'osprey' using build file '/home/users/lz280/IdeaProjects/OSPREY3/build.gradle.kts'.
kotlin scripting plugin: created the scripting discovery configuration: kotlinScriptDef
kotlin scripting plugin: created the scripting discovery configuration: testKotlinScriptDef
------------------------------------------------------------------------
Detecting the operating system and CPU architecture
------------------------------------------------------------------------
os.detected.name=linux
os.detected.arch=x86_64
os.detected.version=5.15
os.detected.version.major=5
os.detected.version.minor=15
os.detected.release=org.freedesktop.platform
os.detected.release.version=25.08
os.detected.release.like.org.freedesktop.platform=true
os.detected.classifier=linux-x86_64
Caching disabled for Kotlin DSL accessors for root project 'osprey' because:
  Build cache is disabled
Skipping Kotlin DSL accessors for root project 'osprey' as it is up-to-date.
All projects evaluated.
Selected primary task 'clean' from project :
Selected primary task 'test' from project :
Tasks to be executed: [task ':clean', task ':compileKotlin', task ':compileJava', task ':processResources', task ':classes', task ':compileTestKotlin', task ':compileTestJava', task ':processTestResources', task ':testClasses', task ':test']
Tasks that were excluded: []
:clean (Thread[Execution worker for ':',5,main]) started.

> Task :clean
Caching disabled for task ':clean' because:
  Build cache is disabled
Task ':clean' is not up-to-date because:
  Task has not declared any outputs despite executing actions.
:clean (Thread[Execution worker for ':',5,main]) completed. Took 2.536 secs.
:compileKotlin (Thread[Execution worker for ':',5,main]) started.

> Task :compileKotlin
Caching disabled for task ':compileKotlin' because:
  Build cache is disabled
Task ':compileKotlin' is not up-to-date because:
  Output property 'destinationDirectory' file /home/users/lz280/IdeaProjects/OSPREY3/build/classes/kotlin/main has been removed.
  Output property 'destinationDirectory' file /home/users/lz280/IdeaProjects/OSPREY3/build/classes/kotlin/main/edu has been removed.
  Output property 'destinationDirectory' file /home/users/lz280/IdeaProjects/OSPREY3/build/classes/kotlin/main/edu/duke has been removed.
The input changes require a full rebuild for incremental task ':compileKotlin'.
Using Kotlin/JVM incremental compilation
[KOTLIN] Kotlin compilation 'jdkHome' argument: /home/users/lz280/java/jdk-17.0.2+8
i: found daemon on port 17911 (503664 ms old), trying to connect
i: connected to the daemon
Options for KOTLIN DAEMON: IncrementalCompilationOptions(super=CompilationOptions(compilerMode=INCREMENTAL_COMPILER, targetPlatform=JVM, reportCategories=[0], reportSeverity=2, requestedCompilationResults=[0]kotlinScriptExtensions=[kt, kts, java]), areFileChangesKnown=false, modifiedFiles=null, deletedFiles=null, classpathChanges=org.jetbrains.kotlin.incremental.ClasspathChanges$NotAvailable$ClasspathSnapshotIsDisabled@75dc5728, workingDir=/home/users/lz280/IdeaProjects/OSPREY3/build/kotlin/compileKotlin, multiModuleICSettings=MultiModuleICSettings(buildHistoryFile=/home/users/lz280/IdeaProjects/OSPREY3/build/kotlin/compileKotlin/build-history.bin, useModuleDetection=false), usePreciseJavaTracking=trueoutputFiles=[/home/users/lz280/IdeaProjects/OSPREY3/build/classes/kotlin/main, /home/users/lz280/IdeaProjects/OSPREY3/build/kotlin/compileKotlin])
w: ATTENTION!
This build uses unsafe internal compiler arguments:

-XXLanguage:+InlineClasses

This mode is not recommended for production use,
as no stability/compatibility guarantees are given on
compiler or generated code. Use it at your own risk!

w: '-Xuse-experimental' is deprecated and will be removed in a future release, please use -opt-in instead
w: /home/users/lz280/IdeaProjects/OSPREY3/src/main/kotlin/edu/duke/cs/osprey/gui/compiler/CompilerProgress.kt: (48, 31): 'sumBy((T) -> Int): Int' is deprecated. Use sumOf instead.
w: /home/users/lz280/IdeaProjects/OSPREY3/src/main/kotlin/edu/duke/cs/osprey/gui/compiler/CompilerProgress.kt: (48, 59): 'sumBy((T) -> Int): Int' is deprecated. Use sumOf instead.
w: /home/users/lz280/IdeaProjects/OSPREY3/src/main/kotlin/edu/duke/cs/osprey/gui/compiler/ConfSpaceCompiler.kt: (54, 45): 'sumBy((T) -> Int): Int' is deprecated. Use sumOf instead.
w: /home/users/lz280/IdeaProjects/OSPREY3/src/main/kotlin/edu/duke/cs/osprey/gui/compiler/ConfSpaceCompiler.kt: (55, 51): 'sumBy((T) -> Int): Int' is deprecated. Use sumOf instead.
w: /home/users/lz280/IdeaProjects/OSPREY3/src/main/kotlin/edu/duke/cs/osprey/gui/compiler/ConfSpaceCompiler.kt: (324, 28): Parameter 'assignments' is never used, could be renamed to _
w: /home/users/lz280/IdeaProjects/OSPREY3/src/main/kotlin/edu/duke/cs/osprey/gui/features/components/ConfPosEditor.kt: (108, 31): 'sumBy((T) -> Int): Int' is deprecated. Use sumOf instead.
w: /home/users/lz280/IdeaProjects/OSPREY3/src/main/kotlin/edu/duke/cs/osprey/gui/features/components/ConfPosEditor.kt: (109, 28): 'sumBy((T) -> Int): Int' is deprecated. Use sumOf instead.
w: /home/users/lz280/IdeaProjects/OSPREY3/src/main/kotlin/edu/duke/cs/osprey/gui/features/components/ConfPosEditor.kt: (314, 36): Parameter 'view' is never used
w: /home/users/lz280/IdeaProjects/OSPREY3/src/main/kotlin/edu/duke/cs/osprey/gui/features/components/DesignPositionEditor.kt: (45, 44): Parameter 'view' is never used
w: /home/users/lz280/IdeaProjects/OSPREY3/src/main/kotlin/edu/duke/cs/osprey/gui/features/components/DesignPositionEditor.kt: (78, 51): Parameter 'view' is never used
w: /home/users/lz280/IdeaProjects/OSPREY3/src/main/kotlin/edu/duke/cs/osprey/gui/features/components/DesignPositionEditor.kt: (319, 28): Parameter 'view' is never used
w: /home/users/lz280/IdeaProjects/OSPREY3/src/main/kotlin/edu/duke/cs/osprey/gui/features/components/DesignPositionEditor.kt: (448, 40): Parameter 'view' is never used, could be renamed to _
w: /home/users/lz280/IdeaProjects/OSPREY3/src/main/kotlin/edu/duke/cs/osprey/gui/features/slide/ClashViewer.kt: (133, 32): 'sumBy((T) -> Int): Int' is deprecated. Use sumOf instead.
w: /home/users/lz280/IdeaProjects/OSPREY3/src/main/kotlin/edu/duke/cs/osprey/gui/features/slide/ClashViewer.kt: (134, 38): 'sumBy((T) -> Int): Int' is deprecated. Use sumOf instead.
w: /home/users/lz280/IdeaProjects/OSPREY3/src/main/kotlin/edu/duke/cs/osprey/gui/features/slide/CompileConfSpace.kt: (198, 50): 'sumBy((T) -> Int): Int' is deprecated. Use sumOf instead.
w: /home/users/lz280/IdeaProjects/OSPREY3/src/main/kotlin/edu/duke/cs/osprey/gui/features/slide/CompileConfSpace.kt: (361, 30): Parameter 'extra' is never used, could be renamed to _
w: /home/users/lz280/IdeaProjects/OSPREY3/src/main/kotlin/edu/duke/cs/osprey/gui/features/slide/ExportMol2.kt: (35, 19): Parameter 'slide' is never used
w: /home/users/lz280/IdeaProjects/OSPREY3/src/main/kotlin/edu/duke/cs/osprey/gui/features/slide/ExportPDB.kt: (35, 19): Parameter 'slide' is never used
w: /home/users/lz280/IdeaProjects/OSPREY3/src/main/kotlin/edu/duke/cs/osprey/gui/features/slide/FilterTool.kt: (138, 30): Parameter 'slide' is never used
w: /home/users/lz280/IdeaProjects/OSPREY3/src/main/kotlin/edu/duke/cs/osprey/gui/features/slide/MutationEditor.kt: (248, 38): Parameter 'view' is never used
w: /home/users/lz280/IdeaProjects/OSPREY3/src/main/kotlin/edu/duke/cs/osprey/gui/features/slide/SaveOMOL.kt: (36, 19): Parameter 'slide' is never used
w: /home/users/lz280/IdeaProjects/OSPREY3/src/main/kotlin/edu/duke/cs/osprey/gui/forcefield/amber/TopIO.kt: (393, 52): Parameter 'atom' is never used, could be renamed to _
w: /home/users/lz280/IdeaProjects/OSPREY3/src/main/kotlin/edu/duke/cs/osprey/gui/forcefield/amber/TopIO.kt: (393, 64): Parameter 'residue' is never used, could be renamed to _
w: /home/users/lz280/IdeaProjects/OSPREY3/src/main/kotlin/edu/duke/cs/osprey/gui/forcefield/amber/molPartitioning.kt: (325, 34): Parameter 'i' is never used, could be renamed to _
w: /home/users/lz280/IdeaProjects/OSPREY3/src/main/kotlin/edu/duke/cs/osprey/gui/forcefield/amber/platform.kt: (37, 18): 'toLowerCase(): String' is deprecated. Use lowercase() instead.
w: /home/users/lz280/IdeaProjects/OSPREY3/src/main/kotlin/edu/duke/cs/osprey/gui/forcefield/amber/platform.kt: (53, 35): 'toLowerCase(): String' is deprecated. Use lowercase() instead.
w: /home/users/lz280/IdeaProjects/OSPREY3/src/main/kotlin/edu/duke/cs/osprey/gui/io/CompiledConfSpace.kt: (74, 5): 'when' is exhaustive so 'else' is redundant here
w: /home/users/lz280/IdeaProjects/OSPREY3/src/main/kotlin/edu/duke/cs/osprey/gui/io/ConfLib.kt: (296, 22): Parameter 'from' is never used, could be renamed to _
w: /home/users/lz280/IdeaProjects/OSPREY3/src/main/kotlin/edu/duke/cs/osprey/gui/io/ConfLib.kt: (496, 48): 'toLowerCase(): String' is deprecated. Use lowercase() instead.
w: /home/users/lz280/IdeaProjects/OSPREY3/src/main/kotlin/edu/duke/cs/osprey/gui/io/MOL2.kt: (98, 52): 'sumBy((T) -> Int): Int' is deprecated. Use sumOf instead.
w: /home/users/lz280/IdeaProjects/OSPREY3/src/main/kotlin/edu/duke/cs/osprey/gui/io/MOL2.kt: (247, 7): 'toUpperCase(): String' is deprecated. Use uppercase() instead.
w: /home/users/lz280/IdeaProjects/OSPREY3/src/main/kotlin/edu/duke/cs/osprey/gui/io/PDB.kt: (216, 44): 'toLowerCase(): String' is deprecated. Use lowercase() instead.
w: /home/users/lz280/IdeaProjects/OSPREY3/src/main/kotlin/edu/duke/cs/osprey/gui/io/PDB.kt: (217, 44): 'toLowerCase(): String' is deprecated. Use lowercase() instead.
w: /home/users/lz280/IdeaProjects/OSPREY3/src/main/kotlin/edu/duke/cs/osprey/gui/io/PDB.kt: (277, 48): 'toUpperCase(): String' is deprecated. Use uppercase() instead.
w: /home/users/lz280/IdeaProjects/OSPREY3/src/main/kotlin/edu/duke/cs/osprey/gui/main.kt: (84, 44): Parameter 'wait' is never used
w: /home/users/lz280/IdeaProjects/OSPREY3/src/main/kotlin/edu/duke/cs/osprey/gui/prep/BondGuesser.kt: (98, 2): Parameter 'guesser' is never used
w: /home/users/lz280/IdeaProjects/OSPREY3/src/main/kotlin/edu/duke/cs/osprey/gui/prep/ConfSpace.kt: (177, 7): 'sumBy((T) -> Int): Int' is deprecated. Use sumOf instead.
w: /home/users/lz280/IdeaProjects/OSPREY3/src/main/kotlin/edu/duke/cs/osprey/gui/view/ProbeView.kt: (70, 5): 'sumBy((T) -> Int): Int' is deprecated. Use sumOf instead.
w: /home/users/lz280/IdeaProjects/OSPREY3/src/main/kotlin/edu/duke/cs/osprey/gui/view/ProbeView.kt: (70, 40): 'sumBy((T) -> Int): Int' is deprecated. Use sumOf instead.
w: /home/users/lz280/IdeaProjects/OSPREY3/src/main/kotlin/edu/duke/cs/osprey/gui/view/ProbeView.kt: (110, 5): 'sumBy((T) -> Int): Int' is deprecated. Use sumOf instead.
w: /home/users/lz280/IdeaProjects/OSPREY3/src/main/kotlin/edu/duke/cs/osprey/gui/view/ProbeView.kt: (110, 43): 'sumBy((T) -> Int): Int' is deprecated. Use sumOf instead.
w: /home/users/lz280/IdeaProjects/OSPREY3/src/main/kotlin/edu/duke/cs/osprey/molscope/gui/features/FeatureId.kt: (6, 35): 'toLowerCase(): String' is deprecated. Use lowercase() instead.
w: /home/users/lz280/IdeaProjects/OSPREY3/src/main/kotlin/edu/duke/cs/osprey/molscope/gui/features/slide/CameraTool.kt: (173, 19): Parameter 'slide' is never used
w: /home/users/lz280/IdeaProjects/OSPREY3/src/main/kotlin/edu/duke/cs/osprey/molscope/molecule/Element.kt: (113, 25): 'toLowerCase(): String' is deprecated. Use lowercase() instead.
w: /home/users/lz280/IdeaProjects/OSPREY3/src/main/kotlin/edu/duke/cs/osprey/molscope/molecule/Element.kt: (118, 20): 'toLowerCase(): String' is deprecated. Use lowercase() instead.
w: /home/users/lz280/IdeaProjects/OSPREY3/src/main/kotlin/edu/duke/cs/osprey/molscope/molecule/Molecule.kt: (155, 34): 'sumBy((T) -> Int): Int' is deprecated. Use sumOf instead.
w: /home/users/lz280/IdeaProjects/OSPREY3/src/main/kotlin/edu/duke/cs/osprey/molscope/molecule/MoleculeSelection.kt: (10, 33): Parameter 'mol' is never used, could be renamed to _
w: /home/users/lz280/IdeaProjects/OSPREY3/src/main/kotlin/edu/duke/cs/osprey/molscope/molecule/MoleculeSelection.kt: (29, 28): 'toUpperCase(): String' is deprecated. Use uppercase() instead.
w: /home/users/lz280/IdeaProjects/OSPREY3/src/main/kotlin/edu/duke/cs/osprey/molscope/render/AmbientOcclusion.kt: (259, 40): 'sumBy((T) -> Int): Int' is deprecated. Use sumOf instead.
w: /home/users/lz280/IdeaProjects/OSPREY3/src/main/kotlin/edu/duke/cs/osprey/molscope/render/AmbientOcclusion.kt: (281, 44): 'sumBy((T) -> Int): Int' is deprecated. Use sumOf instead.
w: /home/users/lz280/IdeaProjects/OSPREY3/src/main/kotlin/edu/duke/cs/osprey/service/services/about.kt: (20, 10): Parameter 'instance' is never used
:compileKotlin (Thread[Execution worker for ':',5,main]) completed. Took 52.39 secs.
:compileJava (Thread[Execution worker for ':',5,main]) started.

> Task :compileJava
Caching disabled for task ':compileJava' because:
  Build cache is disabled
Task ':compileJava' is not up-to-date because:
  Output property 'destinationDirectory' file /home/users/lz280/IdeaProjects/OSPREY3/build/classes/java/main has been removed.
  Output property 'destinationDirectory' file /home/users/lz280/IdeaProjects/OSPREY3/build/classes/java/main/edu has been removed.
  Output property 'destinationDirectory' file /home/users/lz280/IdeaProjects/OSPREY3/build/classes/java/main/edu/duke has been removed.
The input changes require a full rebuild for incremental task ':compileJava'.
Full recompilation is required because no incremental change information is available. This is usually caused by clean builds or changing compiler arguments.
Compiling with toolchain '/home/users/lz280/java/jdk-17.0.2+8'.
Compiling with JDK Java compiler API.
warning: using incubating module(s): jdk.incubator.foreign
warning: using incubating module(s): jdk.incubator.foreign
warning: using incubating module(s): jdk.incubator.foreign
warning: using incubating module(s): jdk.incubator.foreign
/home/users/lz280/IdeaProjects/OSPREY3/src/main/java/edu/duke/cs/osprey/energy/forcefield/EEF1.java:110: warning: [removal] Double(String) in Double has been deprecated and marked for removal
				atEEF1Vol[tmpInt] = (new Double(StringParsing.getToken(curLine,3))).doubleValue();
				                     ^
/home/users/lz280/IdeaProjects/OSPREY3/src/main/java/edu/duke/cs/osprey/energy/forcefield/EEF1.java:111: warning: [removal] Double(String) in Double has been deprecated and marked for removal
				dGiRef[tmpInt] = (new Double(StringParsing.getToken(curLine,4))).doubleValue();
				                  ^
/home/users/lz280/IdeaProjects/OSPREY3/src/main/java/edu/duke/cs/osprey/energy/forcefield/EEF1.java:112: warning: [removal] Double(String) in Double has been deprecated and marked for removal
				dGiFree[tmpInt] = (new Double(StringParsing.getToken(curLine,5))).doubleValue();
				                   ^
/home/users/lz280/IdeaProjects/OSPREY3/src/main/java/edu/duke/cs/osprey/energy/forcefield/EEF1.java:113: warning: [removal] Double(String) in Double has been deprecated and marked for removal
				dHiRef[tmpInt] = (new Double(StringParsing.getToken(curLine,6))).doubleValue();
				                  ^
/home/users/lz280/IdeaProjects/OSPREY3/src/main/java/edu/duke/cs/osprey/energy/forcefield/EEF1.java:114: warning: [removal] Double(String) in Double has been deprecated and marked for removal
				dCpiRef[tmpInt] = (new Double(StringParsing.getToken(curLine,7))).doubleValue();
				                   ^
/home/users/lz280/IdeaProjects/OSPREY3/src/main/java/edu/duke/cs/osprey/energy/forcefield/EEF1.java:115: warning: [removal] Double(String) in Double has been deprecated and marked for removal
				lambdai[tmpInt] = (new Double(StringParsing.getToken(curLine,8))).doubleValue();
				                   ^
/home/users/lz280/IdeaProjects/OSPREY3/src/main/java/edu/duke/cs/osprey/energy/forcefield/EEF1.java:116: warning: [removal] Double(String) in Double has been deprecated and marked for removal
				vdWri[tmpInt] = (new Double(StringParsing.getToken(curLine,9))).doubleValue();
				                 ^
/home/users/lz280/IdeaProjects/OSPREY3/src/main/java/edu/duke/cs/osprey/ematrix/EnergyMatrixCalculator.java:239: warning: [removal] Integer(int) in Integer has been deprecated and marked for removal
				Integer[] pos = new Integer[res.length]; for(int i = 0; i < pos.length; ++i) pos[i] = new Integer(res[i]);
				                                                                                      ^
/home/users/lz280/IdeaProjects/OSPREY3/src/main/java/edu/duke/cs/osprey/ematrix/TermECalculator.java:240: warning: [removal] Integer(int) in Integer has been deprecated and marked for removal
			resElements[depth] = new Integer(res[depth]);
			                     ^
/home/users/lz280/IdeaProjects/OSPREY3/src/main/java/edu/duke/cs/osprey/restypes/TemplateCoordsParser.java:157: warning: [removal] Double(String) in Double has been deprecated and marked for removal
				coords[dim] = new Double(StringParsing.getToken(line,dim+2));
				              ^
Note: Some input files use or override a deprecated API.
Note: Recompile with -Xlint:deprecation for details.
Note: Some input files use unchecked or unsafe operations.
Note: Recompile with -Xlint:unchecked for details.
14 warnings
Class dependency analysis for incremental compilation took 0.81 secs.
Created classpath snapshot for incremental compilation in 0.061 secs.
:compileJava (Thread[Execution worker for ':',5,main]) completed. Took 8.46 secs.
:processResources (Thread[Execution worker for ':',5,main]) started.

> Task :processResources
Caching disabled for task ':processResources' because:
  Build cache is disabled
Task ':processResources' is not up-to-date because:
  Task.upToDateWhen is false.
:processResources (Thread[Execution worker for ':',5,main]) completed. Took 0.685 secs.
:classes (Thread[Execution worker for ':',5,main]) started.

> Task :classes
Skipping task ':classes' as it has no actions.
:classes (Thread[Execution worker for ':',5,main]) completed. Took 0.0 secs.
:compileTestKotlin (Thread[Execution worker for ':',5,main]) started.

> Task :compileTestKotlin
Caching disabled for task ':compileTestKotlin' because:
  Build cache is disabled
Task ':compileTestKotlin' is not up-to-date because:
  Output property 'destinationDirectory' file /home/users/lz280/IdeaProjects/OSPREY3/build/classes/kotlin/test has been removed.
  Output property 'destinationDirectory' file /home/users/lz280/IdeaProjects/OSPREY3/build/classes/kotlin/test/edu has been removed.
  Output property 'destinationDirectory' file /home/users/lz280/IdeaProjects/OSPREY3/build/classes/kotlin/test/edu/duke has been removed.
The input changes require a full rebuild for incremental task ':compileTestKotlin'.
Using Kotlin/JVM incremental compilation
[KOTLIN] Kotlin compilation 'jdkHome' argument: /home/users/lz280/java/jdk-17.0.2+8
i: found daemon on port 17911 (565173 ms old), trying to connect
i: connected to the daemon
Options for KOTLIN DAEMON: IncrementalCompilationOptions(super=CompilationOptions(compilerMode=INCREMENTAL_COMPILER, targetPlatform=JVM, reportCategories=[0], reportSeverity=2, requestedCompilationResults=[0]kotlinScriptExtensions=[kt, kts, java]), areFileChangesKnown=false, modifiedFiles=null, deletedFiles=null, classpathChanges=org.jetbrains.kotlin.incremental.ClasspathChanges$NotAvailable$ClasspathSnapshotIsDisabled@75dc5728, workingDir=/home/users/lz280/IdeaProjects/OSPREY3/build/kotlin/compileTestKotlin, multiModuleICSettings=MultiModuleICSettings(buildHistoryFile=/home/users/lz280/IdeaProjects/OSPREY3/build/kotlin/compileTestKotlin/build-history.bin, useModuleDetection=false), usePreciseJavaTracking=trueoutputFiles=[/home/users/lz280/IdeaProjects/OSPREY3/build/classes/kotlin/test, /home/users/lz280/IdeaProjects/OSPREY3/build/kotlin/compileTestKotlin])
w: ATTENTION!
This build uses unsafe internal compiler arguments:

-XXLanguage:+InlineClasses

This mode is not recommended for production use,
as no stability/compatibility guarantees are given on
compiler or generated code. Use it at your own risk!

w: '-Xuse-experimental' is deprecated and will be removed in a future release, please use -opt-in instead
w: /home/users/lz280/IdeaProjects/OSPREY3/src/test/kotlin/edu/duke/cs/osprey/gui/forcefield/amber/TestParams.kt: (20, 20): 'toLowerCase(): String' is deprecated. Use lowercase() instead.
w: /home/users/lz280/IdeaProjects/OSPREY3/src/test/kotlin/edu/duke/cs/osprey/gui/forcefield/amber/TestParams.kt: (20, 42): 'toLowerCase(): String' is deprecated. Use lowercase() instead.
w: /home/users/lz280/IdeaProjects/OSPREY3/src/test/kotlin/edu/duke/cs/osprey/gui/forcefield/amber/TestPolymerPartitioning.kt: (97, 12): 'shouldBeTypeOf((T) -> Unit = ...): T' is deprecated. Use the smart contract version: a.shouldBeTypeOf<B>(); a.bMethod(). Deprecated since 4.5.
w: /home/users/lz280/IdeaProjects/OSPREY3/src/test/kotlin/edu/duke/cs/osprey/gui/io/TestCompiledAtomPairs.kt: (75, 11): 'invoke(Boolean, String, String): MatcherResult' is deprecated. Prefer the version that accepts functions - this avoids eager creation of messages. This was deprecated in 5.0.
w: /home/users/lz280/IdeaProjects/OSPREY3/src/test/kotlin/edu/duke/cs/osprey/gui/io/TestCompiledAtomPairs.kt: (195, 11): 'invoke(Boolean, String, String): MatcherResult' is deprecated. Prefer the version that accepts functions - this avoids eager creation of messages. This was deprecated in 5.0.
w: /home/users/lz280/IdeaProjects/OSPREY3/src/test/kotlin/edu/duke/cs/osprey/gui/io/TestCompiledAtomPairs.kt: (217, 11): 'invoke(Boolean, String, String): MatcherResult' is deprecated. Prefer the version that accepts functions - this avoids eager creation of messages. This was deprecated in 5.0.
w: /home/users/lz280/IdeaProjects/OSPREY3/src/test/kotlin/edu/duke/cs/osprey/gui/io/TestConfLib.kt: (61, 15): 'shouldBeTypeOf((T) -> Unit = ...): T' is deprecated. Use the smart contract version: a.shouldBeTypeOf<B>(); a.bMethod(). Deprecated since 4.5.
w: /home/users/lz280/IdeaProjects/OSPREY3/src/test/kotlin/edu/duke/cs/osprey/gui/io/TestConfLib.kt: (63, 14): 'shouldBeTypeOf((T) -> Unit = ...): T' is deprecated. Use the smart contract version: a.shouldBeTypeOf<B>(); a.bMethod(). Deprecated since 4.5.
w: /home/users/lz280/IdeaProjects/OSPREY3/src/test/kotlin/edu/duke/cs/osprey/gui/io/TestConfLib.kt: (67, 14): 'shouldBeTypeOf((T) -> Unit = ...): T' is deprecated. Use the smart contract version: a.shouldBeTypeOf<B>(); a.bMethod(). Deprecated since 4.5.
w: /home/users/lz280/IdeaProjects/OSPREY3/src/test/kotlin/edu/duke/cs/osprey/gui/io/TestConfLib.kt: (71, 14): 'shouldBeTypeOf((T) -> Unit = ...): T' is deprecated. Use the smart contract version: a.shouldBeTypeOf<B>(); a.bMethod(). Deprecated since 4.5.
w: /home/users/lz280/IdeaProjects/OSPREY3/src/test/kotlin/edu/duke/cs/osprey/gui/io/TestConfLib.kt: (74, 14): 'shouldBeTypeOf((T) -> Unit = ...): T' is deprecated. Use the smart contract version: a.shouldBeTypeOf<B>(); a.bMethod(). Deprecated since 4.5.
w: /home/users/lz280/IdeaProjects/OSPREY3/src/test/kotlin/edu/duke/cs/osprey/gui/io/TestConfLib.kt: (86, 37): 'shouldBeTypeOf((T) -> Unit = ...): T' is deprecated. Use the smart contract version: a.shouldBeTypeOf<B>(); a.bMethod(). Deprecated since 4.5.
w: /home/users/lz280/IdeaProjects/OSPREY3/src/test/kotlin/edu/duke/cs/osprey/gui/io/TestConfLib.kt: (89, 36): 'shouldBeTypeOf((T) -> Unit = ...): T' is deprecated. Use the smart contract version: a.shouldBeTypeOf<B>(); a.bMethod(). Deprecated since 4.5.
w: /home/users/lz280/IdeaProjects/OSPREY3/src/test/kotlin/edu/duke/cs/osprey/gui/io/TestConfLib.kt: (143, 35): 'shouldBeTypeOf((T) -> Unit = ...): T' is deprecated. Use the smart contract version: a.shouldBeTypeOf<B>(); a.bMethod(). Deprecated since 4.5.
w: /home/users/lz280/IdeaProjects/OSPREY3/src/test/kotlin/edu/duke/cs/osprey/gui/io/TestConfLib.kt: (224, 8): Variable 'toml' is never used
w: /home/users/lz280/IdeaProjects/OSPREY3/src/test/kotlin/edu/duke/cs/osprey/gui/io/TestConfSpaceCompiler.kt: (182, 5): 'sumBy((T) -> Int): Int' is deprecated. Use sumOf instead.
w: /home/users/lz280/IdeaProjects/OSPREY3/src/test/kotlin/edu/duke/cs/osprey/gui/io/TestConfSpaceCompiler.kt: (183, 16): 'sumBy((T) -> Int): Int' is deprecated. Use sumOf instead.
w: /home/users/lz280/IdeaProjects/OSPREY3/src/test/kotlin/edu/duke/cs/osprey/gui/io/TestConfSpaceCompiler.kt: (185, 23): 'sumBy((T) -> Int): Int' is deprecated. Use sumOf instead.
w: /home/users/lz280/IdeaProjects/OSPREY3/src/test/kotlin/edu/duke/cs/osprey/gui/io/TestConfSpaceCompiler.kt: (229, 46): 'sumBy((T) -> Int): Int' is deprecated. Use sumOf instead.
w: /home/users/lz280/IdeaProjects/OSPREY3/src/test/kotlin/edu/duke/cs/osprey/gui/io/TestConfSpaceCompiler.kt: (230, 21): 'sumBy((T) -> Int): Int' is deprecated. Use sumOf instead.
w: /home/users/lz280/IdeaProjects/OSPREY3/src/test/kotlin/edu/duke/cs/osprey/gui/io/TestConfSpaceCompiler.kt: (258, 47): 'sumBy((T) -> Int): Int' is deprecated. Use sumOf instead.
w: /home/users/lz280/IdeaProjects/OSPREY3/src/test/kotlin/edu/duke/cs/osprey/gui/io/TestConfSpaceCompiler.kt: (259, 22): 'sumBy((T) -> Int): Int' is deprecated. Use sumOf instead.
w: /home/users/lz280/IdeaProjects/OSPREY3/src/test/kotlin/edu/duke/cs/osprey/gui/io/TestConfSpaceCompiler.kt: (427, 14): 'shouldBeTypeOf((T) -> Unit = ...): T' is deprecated. Use the smart contract version: a.shouldBeTypeOf<B>(); a.bMethod(). Deprecated since 4.5.
w: /home/users/lz280/IdeaProjects/OSPREY3/src/test/kotlin/edu/duke/cs/osprey/gui/io/TestConfSpaceCompiler.kt: (448, 15): 'shouldBeTypeOf((T) -> Unit = ...): T' is deprecated. Use the smart contract version: a.shouldBeTypeOf<B>(); a.bMethod(). Deprecated since 4.5.
w: /home/users/lz280/IdeaProjects/OSPREY3/src/test/kotlin/edu/duke/cs/osprey/gui/io/TestConfSpaceCompiler.kt: (471, 15): 'shouldBeTypeOf((T) -> Unit = ...): T' is deprecated. Use the smart contract version: a.shouldBeTypeOf<B>(); a.bMethod(). Deprecated since 4.5.
w: /home/users/lz280/IdeaProjects/OSPREY3/src/test/kotlin/edu/duke/cs/osprey/gui/io/TestConfSpaceCompiler.kt: (493, 15): 'shouldBeTypeOf((T) -> Unit = ...): T' is deprecated. Use the smart contract version: a.shouldBeTypeOf<B>(); a.bMethod(). Deprecated since 4.5.
w: /home/users/lz280/IdeaProjects/OSPREY3/src/test/kotlin/edu/duke/cs/osprey/gui/io/TestConfSpaceCompiler.kt: (535, 14): 'shouldBeTypeOf((T) -> Unit = ...): T' is deprecated. Use the smart contract version: a.shouldBeTypeOf<B>(); a.bMethod(). Deprecated since 4.5.
w: /home/users/lz280/IdeaProjects/OSPREY3/src/test/kotlin/edu/duke/cs/osprey/gui/io/TestConfSpaceCompiler.kt: (573, 15): 'shouldBeTypeOf((T) -> Unit = ...): T' is deprecated. Use the smart contract version: a.shouldBeTypeOf<B>(); a.bMethod(). Deprecated since 4.5.
w: /home/users/lz280/IdeaProjects/OSPREY3/src/test/kotlin/edu/duke/cs/osprey/gui/io/TestMolIO.kt: (282, 6): 'shouldBeInstanceOf((T) -> Unit = ...): T' is deprecated. Use the smart contract version: a.shouldBeInstanceOf<B>(); a.bMethod(). Deprecated since 4.5.
w: /home/users/lz280/IdeaProjects/OSPREY3/src/test/kotlin/edu/duke/cs/osprey/gui/io/TestMolIO.kt: (318, 6): 'shouldBeInstanceOf((T) -> Unit = ...): T' is deprecated. Use the smart contract version: a.shouldBeInstanceOf<B>(); a.bMethod(). Deprecated since 4.5.
w: /home/users/lz280/IdeaProjects/OSPREY3/src/test/kotlin/edu/duke/cs/osprey/gui/matchers.kt: (11, 3): 'invoke(Boolean, String, String): MatcherResult' is deprecated. Prefer the version that accepts functions - this avoids eager creation of messages. This was deprecated in 5.0.
w: /home/users/lz280/IdeaProjects/OSPREY3/src/test/kotlin/edu/duke/cs/osprey/gui/matchers.kt: (20, 3): 'invoke(Boolean, String, String): MatcherResult' is deprecated. Prefer the version that accepts functions - this avoids eager creation of messages. This was deprecated in 5.0.
w: /home/users/lz280/IdeaProjects/OSPREY3/src/test/kotlin/edu/duke/cs/osprey/gui/matchers.kt: (40, 4): 'invoke(Boolean, String, String): MatcherResult' is deprecated. Prefer the version that accepts functions - this avoids eager creation of messages. This was deprecated in 5.0.
w: /home/users/lz280/IdeaProjects/OSPREY3/src/test/kotlin/edu/duke/cs/osprey/gui/matchers.kt: (63, 4): 'invoke(Boolean, String, String): MatcherResult' is deprecated. Prefer the version that accepts functions - this avoids eager creation of messages. This was deprecated in 5.0.
w: /home/users/lz280/IdeaProjects/OSPREY3/src/test/kotlin/edu/duke/cs/osprey/gui/prep/ForcefieldAnalyzerLab.kt: (15, 6): Variable 'bptpase' is never used
w: /home/users/lz280/IdeaProjects/OSPREY3/src/test/kotlin/edu/duke/cs/osprey/gui/prep/TestMutation.kt: (142, 16): 'shouldBeTypeOf((T) -> Unit = ...): T' is deprecated. Use the smart contract version: a.shouldBeTypeOf<B>(); a.bMethod(). Deprecated since 4.5.
w: /home/users/lz280/IdeaProjects/OSPREY3/src/test/kotlin/edu/duke/cs/osprey/gui/prep/TestMutation.kt: (146, 17): 'shouldBeTypeOf((T) -> Unit = ...): T' is deprecated. Use the smart contract version: a.shouldBeTypeOf<B>(); a.bMethod(). Deprecated since 4.5.
w: /home/users/lz280/IdeaProjects/OSPREY3/src/test/kotlin/edu/duke/cs/osprey/gui/prep/TestMutation.kt: (151, 15): 'shouldBeTypeOf((T) -> Unit = ...): T' is deprecated. Use the smart contract version: a.shouldBeTypeOf<B>(); a.bMethod(). Deprecated since 4.5.
w: /home/users/lz280/IdeaProjects/OSPREY3/src/test/kotlin/edu/duke/cs/osprey/gui/prep/TestMutation.kt: (155, 16): 'shouldBeTypeOf((T) -> Unit = ...): T' is deprecated. Use the smart contract version: a.shouldBeTypeOf<B>(); a.bMethod(). Deprecated since 4.5.
w: /home/users/lz280/IdeaProjects/OSPREY3/src/test/kotlin/edu/duke/cs/osprey/gui/prep/TestMutation.kt: (166, 16): 'shouldBeTypeOf((T) -> Unit = ...): T' is deprecated. Use the smart contract version: a.shouldBeTypeOf<B>(); a.bMethod(). Deprecated since 4.5.
w: /home/users/lz280/IdeaProjects/OSPREY3/src/test/kotlin/edu/duke/cs/osprey/gui/prep/TestMutation.kt: (170, 17): 'shouldBeTypeOf((T) -> Unit = ...): T' is deprecated. Use the smart contract version: a.shouldBeTypeOf<B>(); a.bMethod(). Deprecated since 4.5.
w: /home/users/lz280/IdeaProjects/OSPREY3/src/test/kotlin/edu/duke/cs/osprey/gui/prep/TestMutation.kt: (181, 14): 'shouldBeTypeOf((T) -> Unit = ...): T' is deprecated. Use the smart contract version: a.shouldBeTypeOf<B>(); a.bMethod(). Deprecated since 4.5.
w: /home/users/lz280/IdeaProjects/OSPREY3/src/test/kotlin/edu/duke/cs/osprey/gui/prep/TestMutation.kt: (186, 15): 'shouldBeTypeOf((T) -> Unit = ...): T' is deprecated. Use the smart contract version: a.shouldBeTypeOf<B>(); a.bMethod(). Deprecated since 4.5.
w: /home/users/lz280/IdeaProjects/OSPREY3/src/test/kotlin/edu/duke/cs/osprey/gui/prep/TestMutation.kt: (529, 13): 'shouldBeTypeOf((T) -> Unit = ...): T' is deprecated. Use the smart contract version: a.shouldBeTypeOf<B>(); a.bMethod(). Deprecated since 4.5.
w: /home/users/lz280/IdeaProjects/OSPREY3/src/test/kotlin/edu/duke/cs/osprey/gui/prep/TestMutation.kt: (530, 38): 'shouldBeTypeOf((T) -> Unit = ...): T' is deprecated. Use the smart contract version: a.shouldBeTypeOf<B>(); a.bMethod(). Deprecated since 4.5.
w: /home/users/lz280/IdeaProjects/OSPREY3/src/test/kotlin/edu/duke/cs/osprey/gui/prep/TestMutation.kt: (637, 9): Variable 'res' is never used
w: /home/users/lz280/IdeaProjects/OSPREY3/src/test/kotlin/edu/duke/cs/osprey/molscope/molecule/TestMoleculeCombine.kt: (167, 7): Variable 'srcRes1' is never used
w: /home/users/lz280/IdeaProjects/OSPREY3/src/test/kotlin/edu/duke/cs/osprey/molscope/molecule/TestMoleculeCombine.kt: (174, 7): Variable 'srcRes2' is never used
w: /home/users/lz280/IdeaProjects/OSPREY3/src/test/kotlin/edu/duke/cs/osprey/molscope/molecule/TestMoleculeCombine.kt: (188, 7): Variable 'srcRes1' is never used
w: /home/users/lz280/IdeaProjects/OSPREY3/src/test/kotlin/edu/duke/cs/osprey/molscope/molecule/TestMoleculeCombine.kt: (195, 7): Variable 'srcRes2' is never used
w: /home/users/lz280/IdeaProjects/OSPREY3/src/test/kotlin/edu/duke/cs/osprey/molscope/molecule/TestMoleculeCombine.kt: (201, 18): Variable 'atomMap' is never used
w: /home/users/lz280/IdeaProjects/OSPREY3/src/test/kotlin/edu/duke/cs/osprey/molscope/molecule/TestMoleculeCombine.kt: (218, 7): Variable 'srcRes2' is never used
w: /home/users/lz280/IdeaProjects/OSPREY3/src/test/kotlin/edu/duke/cs/osprey/molscope/molecule/TestMoleculeCombine.kt: (220, 18): Variable 'atomMap' is never used
w: /home/users/lz280/IdeaProjects/OSPREY3/src/test/kotlin/edu/duke/cs/osprey/molscope/molecule/TestMoleculeCombine.kt: (226, 13): 'sumBy((T) -> Int): Int' is deprecated. Use sumOf instead.
w: /home/users/lz280/IdeaProjects/OSPREY3/src/test/kotlin/edu/duke/cs/osprey/molscope/molecule/TestMoleculeCombine.kt: (243, 7): Variable 'srcRes2' is never used
w: /home/users/lz280/IdeaProjects/OSPREY3/src/test/kotlin/edu/duke/cs/osprey/molscope/molecule/TestMoleculeCombine.kt: (256, 18): Variable 'atomMap' is never used
w: /home/users/lz280/IdeaProjects/OSPREY3/src/test/kotlin/edu/duke/cs/osprey/molscope/molecule/TestMoleculeCombine.kt: (262, 13): 'sumBy((T) -> Int): Int' is deprecated. Use sumOf instead.
w: /home/users/lz280/IdeaProjects/OSPREY3/src/test/kotlin/edu/duke/cs/osprey/molscope/molecule/TestMoleculeHashEquals.kt: (79, 7): Variable 'a3' is never used
:compileTestKotlin (Thread[Execution worker for ':',5,main]) completed. Took 13.042 secs.
:compileTestJava (Thread[Execution worker for ':',5,main]) started.

> Task :compileTestJava
Caching disabled for task ':compileTestJava' because:
  Build cache is disabled
Task ':compileTestJava' is not up-to-date because:
  Output property 'destinationDirectory' file /home/users/lz280/IdeaProjects/OSPREY3/build/classes/java/test has been removed.
  Output property 'destinationDirectory' file /home/users/lz280/IdeaProjects/OSPREY3/build/classes/java/test/edu has been removed.
  Output property 'destinationDirectory' file /home/users/lz280/IdeaProjects/OSPREY3/build/classes/java/test/edu/duke has been removed.
The input changes require a full rebuild for incremental task ':compileTestJava'.
Full recompilation is required because no incremental change information is available. This is usually caused by clean builds or changing compiler arguments.
Compiling with toolchain '/home/users/lz280/java/jdk-17.0.2+8'.
Compiling with JDK Java compiler API.
warning: using incubating module(s): jdk.incubator.foreign
Note: Some input files use or override a deprecated API.
Note: Recompile with -Xlint:deprecation for details.
Note: Some input files use unchecked or unsafe operations.
Note: Recompile with -Xlint:unchecked for details.
1 warning
Class dependency analysis for incremental compilation took 0.184 secs.
Created classpath snapshot for incremental compilation in 0.032 secs.
:compileTestJava (Thread[Execution worker for ':',5,main]) completed. Took 4.753 secs.
:processTestResources (Thread[Execution worker for ':',5,main]) started.

> Task :processTestResources
Caching disabled for task ':processTestResources' because:
  Build cache is disabled
Task ':processTestResources' is not up-to-date because:
  Output property 'destinationDir' file /home/users/lz280/IdeaProjects/OSPREY3/build/resources/test has been removed.
  Output property 'destinationDir' file /home/users/lz280/IdeaProjects/OSPREY3/build/resources/test/1CC8.CYX.pdb has been removed.
  Output property 'destinationDir' file /home/users/lz280/IdeaProjects/OSPREY3/build/resources/test/1CC8.ss.pdb has been removed.
:processTestResources (Thread[Execution worker for ':',5,main]) completed. Took 0.738 secs.
:testClasses (Thread[Execution worker for ':',5,main]) started.

> Task :testClasses
Skipping task ':testClasses' as it has no actions.
:testClasses (Thread[Execution worker for ':',5,main]) completed. Took 0.0 secs.
:test (Thread[Execution worker for ':',5,main]) started.
Gradle Test Executor 4 started executing tests.

> Task :test
Caching disabled for task ':test' because:
  Build cache is disabled
Task ':test' is not up-to-date because:
  Output property 'binaryResultsDirectory' file /home/users/lz280/IdeaProjects/OSPREY3/build/test-results/test/binary has been removed.
  Output property 'binaryResultsDirectory' file /home/users/lz280/IdeaProjects/OSPREY3/build/test-results/test/binary/output.bin has been removed.
  Output property 'binaryResultsDirectory' file /home/users/lz280/IdeaProjects/OSPREY3/build/test-results/test/binary/output.bin.idx has been removed.
Starting process 'Gradle Test Executor 4'. Working directory: /home/users/lz280/IdeaProjects/OSPREY3 Command: /home/users/lz280/java/jdk-17.0.2+8/bin/java -Dorg.gradle.internal.worker.tmpdir=/home/users/lz280/IdeaProjects/OSPREY3/build/tmp/test/work -Dorg.gradle.native=false --add-modules=jdk.incubator.foreign @/home/users/lz280/.gradle/.tmp/gradle-worker-classpath17032721513544688117txt -Xmx2g -Dfile.encoding=UTF-8 -Duser.country=US -Duser.language=en -Duser.variant -ea worker.org.gradle.process.internal.worker.GradleWorkerMain 'Gradle Test Executor 4'
Successfully started process 'Gradle Test Executor 4'
WARNING: Using incubator modules: jdk.incubator.foreign

TestMARKStarVsKStarPartitionFunction > testSmallSystem3Flex() STANDARD_OUT

    ========================================
    Testing: Small System (3 flexible residues)
    Number of flexible residues: 3
    Epsilon: 0.1000
    ========================================

    Calculating reference energies for 24 residue confs...
    Progress:  100.0%   ETA: 0 ns
    Finished in 69.6 ms
    Calculating minimizing energy matrix...
    Calculating energy matrix with 213 entries
    Progress:  100.0%   ETA: 0 ns
    Finished in 192.8 ms
    Calculating rigid energy matrix...
    Calculating energy matrix with 213 entries
    Progress:  100.0%   ETA: 0 ns
    Finished in 88.6 ms

    Running K* GradientDescent...
    [8     3     8    ] scores:       0, confs:   1, score:   -5.085246, energy:   -4.772786, bounds:[    3.495281,    Infinity] (log10p1), delta:1.000000, time:  52.36 ms, heapMem:20.0% of 2.0 GiB, 650 MiB alloc, extMem:0 B
    [8     5     8    ] scores:       0, confs:   2, score:   -5.261103, energy:   -4.891207, bounds:[    3.841756,    Infinity] (log10p1), delta:1.000000, time:  77.17 ms, heapMem:20.0% of 2.0 GiB, 650 MiB alloc, extMem:0 B
    [0     4     8    ] scores:       0, confs:   3, score:   -3.597335, energy:   -3.131962, bounds:[    3.853876,    Infinity] (log10p1), delta:1.000000, time:  78.74 ms, heapMem:20.0% of 2.0 GiB, 650 MiB alloc, extMem:0 B
    [0     5     8    ] scores:       0, confs:   4, score:   -5.044793, energy:   -4.507073, bounds:[    3.960982,    Infinity] (log10p1), delta:1.000000, time:  79.99 ms, heapMem:20.0% of 2.0 GiB, 650 MiB alloc, extMem:0 B
    [0     3     8    ] scores:       0, confs:   5, score:   -4.875070, energy:   -4.396592, bounds:[    4.033384,    Infinity] (log10p1), delta:1.000000, time:  81.82 ms, heapMem:20.0% of 2.0 GiB, 650 MiB alloc, extMem:0 B
    [8     4     8    ] scores:       0, confs:   6, score:   -3.819221, energy:   -3.528431, bounds:[    4.048544,    Infinity] (log10p1), delta:1.000000, time:  86.19 ms, heapMem:20.0% of 2.0 GiB, 650 MiB alloc, extMem:0 B
    [8     5     0    ] scores:       0, confs:   7, score:   -3.399019, energy:   -2.825649, bounds:[    4.053075,    Infinity] (log10p1), delta:1.000000, time:  88.59 ms, heapMem:20.0% of 2.0 GiB, 650 MiB alloc, extMem:0 B
    [2     5     8    ] scores:       0, confs:   8, score:   -3.194442, energy:   -2.932978, bounds:[    4.058444,    Infinity] (log10p1), delta:1.000000, time:  90.68 ms, heapMem:20.0% of 2.0 GiB, 650 MiB alloc, extMem:0 B
    [2     3     8    ] scores:      70, confs:   9, score:   -3.014601, energy:   -2.812334, bounds:[    4.062775,    4.125396] (log10p1), delta:0.134286, time: 112.03 ms, heapMem:20.0% of 2.0 GiB, 650 MiB alloc, extMem:0 B
    [4     5     8    ] scores:      70, confs:  10, score:   -2.861508, energy:   -2.619082, bounds:[    4.065876,    4.124033] (log10p1), delta:0.125343, time: 114.27 ms, heapMem:20.0% of 2.0 GiB, 650 MiB alloc, extMem:0 B
    [8     3     6    ] scores:      80, confs:  11, score:   -2.840612, energy:   -2.217998, bounds:[    4.067444,    4.120230] (log10p1), delta:0.114456, time: 119.04 ms, heapMem:20.0% of 2.0 GiB, 650 MiB alloc, extMem:0 B
    [8     2     8    ] scores:      80, confs:  12, score:   -2.844796, energy:   -2.534788, bounds:[    4.070106,    4.118603] (log10p1), delta:0.105667, time: 121.72 ms, heapMem:20.0% of 2.0 GiB, 650 MiB alloc, extMem:0 B
    [0     5     0    ] scores:      80, confs:  13, score:   -3.193550, energy:   -2.416973, bounds:[    4.072277,    4.113308] (log10p1), delta:0.090160, time: 124.34 ms, heapMem:20.0% of 2.0 GiB, 650 MiB alloc, extMem:0 B
    [4     3     8    ] scores:      80, confs:  14, score:   -2.669410, energy:   -2.485095, bounds:[    4.074699,    4.112502] (log10p1), delta:0.083371, time: 126.02 ms, heapMem:20.0% of 2.0 GiB, 650 MiB alloc, extMem:0 B
    [8     3     0    ] scores:      80, confs:  15, score:   -3.185219, energy:   -2.668371, bounds:[    4.077976,    4.108289] (log10p1), delta:0.067423, time: 127.81 ms, heapMem:20.0% of 2.0 GiB, 650 MiB alloc, extMem:0 B
    [8     5     6    ] scores:      80, confs:  16, score:   -3.004802, energy:   -2.330290, bounds:[    4.079818,    4.104626] (log10p1), delta:0.055525, time: 129.13 ms, heapMem:20.0% of 2.0 GiB, 650 MiB alloc, extMem:0 B
    [7     5     8    ] scores:      90, confs:  17, score:   -2.140838, energy:   -1.669267, bounds:[    4.080421,    4.103349] (log10p1), delta:0.051428, time: 130.61 ms, heapMem:20.0% of 2.0 GiB, 650 MiB alloc, extMem:0 B
    [0     3     0    ] scores:      90, confs:  18, score:   -2.985884, energy:   -2.273515, bounds:[    4.082086,    4.099655] (log10p1), delta:0.039650, time: 135.23 ms, heapMem:20.0% of 2.0 GiB, 650 MiB alloc, extMem:0 B
    [0     3     6    ] scores:      90, confs:  19, score:   -2.544798, energy:   -1.730469, bounds:[    4.082751,    4.097768] (log10p1), delta:0.033991, time: 138.52 ms, heapMem:20.0% of 2.0 GiB, 650 MiB alloc, extMem:0 B
    [0     5     6    ] scores:      90, confs:  20, score:   -2.702854, energy:   -1.834080, bounds:[    4.083541,    4.095219] (log10p1), delta:0.026533, time: 141.36 ms, heapMem:20.0% of 2.0 GiB, 650 MiB alloc, extMem:0 B
    [0     2     8    ] scores:      90, confs:  21, score:   -2.647334, energy:   -2.162909, bounds:[    4.084913,    4.093525] (log10p1), delta:0.019635, time: 143.12 ms, heapMem:20.0% of 2.0 GiB, 650 MiB alloc, extMem:0 B
    Total Z upper bound reduction through minimizations: 1.216380e+04
    Average Z upper bound reduction per minimizations: 5.792284e+02
    K* GradientDescent:
      Q* (lower):           1.215843e+04
      P* (upper):           1.240194e+04
      Free Energy Lower:       -5.589859
      Free Energy Upper:       -5.578098
      Confs Evaluated:      21
      Time (ms):            140

    Running MARK*...
    Running until leaf is found...
    MARK* expanded:        18, queued:         0, scored/sec: 7653, partial minimizations:    0, time:5.37 ms, delta:1.00000000000 heapMem:20.0% of 2.0 GiB, 650 MiB alloc, extMem:0 B
    Found a leaf!
    ========== MARK* After runUntilNonZero ==========
      epsilonBound:     0.9073053633350566
      targetEpsilon:    0.1
      lower bound:      2778.5295362875661116656274342020254961289654191461316419850773320675
      upper bound:      29975.0841716000830302519726881964267153048970041816724454437241498401
      Will enter while loop? true
    ==================================================
    Current overall error bound: 0.9073053633, spread of [2.778530e+03, 2.997508e+04]
    Z Comparison: 2.719655e+04, 4.658681e-21
    Processing 16 internal nodes...
    Loop complete. Bounds are now [5.059090e+03,6.163761e+03]
    Current overall error bound: 0.1792202177, spread of [5.059090e+03, 6.163761e+03]
    Z Comparison: 1.104671e+03, 4.658681e-21
    Processing 72 internal nodes...
    Loop complete. Bounds are now [5.168803e+03,5.168803e+03]
    MARK*:
      Q* (lower):           5.168803e+03
      P* (upper):           5.168803e+03
      Free Energy Lower:       -5.070814
      Free Energy Upper:       -5.070814
      Confs Evaluated:      0
      Time (ms):            52

    ========================================
    COMPARISON RESULTS:
    ========================================
    Q* (lower bound) ratio (MARK*/K*): 0.425121
    P* (upper bound) ratio (MARK*/K*): 0.416774
    Gap between bounds (P* - Q*):
      K*:     2.435150e+02
      MARK*:  -1.145450e-13
      Ratio (MARK*/K*): -0.000000
     MARK* produces tighter bounds than K* (-0.00% of K* gap)

    Free Energy Comparison:
      K* range:     [-5.589859, -5.578098]
      MARK* range:  [-5.070814, -5.070814]

    Performance:
      K* evaluated 21 conformations in 140 ms
      MARK* evaluated 0 conformations in 52 ms
      Speedup: 2.69x
    ========================================


Gradle Test Executor 4 finished executing tests.

> Task :test
Finished generating test XML results (0.003 secs) into: /home/users/lz280/IdeaProjects/OSPREY3/build/test-results/test
Generating HTML test report...
Finished generating test html results (0.013 secs) into: /home/users/lz280/IdeaProjects/OSPREY3/build/reports/tests/test
:test (Thread[Execution worker for ':',5,main]) completed. Took 7.307 secs.

Deprecated Gradle features were used in this build, making it incompatible with Gradle 8.0.

You can use '--warning-mode all' to show the individual deprecation warnings and determine if they come from your own scripts or plugins.

See https://docs.gradle.org/7.3/userguide/command_line_interface.html#sec:command_line_warnings

BUILD SUCCESSFUL in 1m 31s
19 actionable tasks: 8 executed, 11 up-to-date
Some of the file system contents retained in the virtual file system are on file systems that Gradle doesn't support watching. The relevant state was discarded to ensure changes to these locations are properly detected. You can override this by explicitly enabling file system watching.
